{
  "id": "pack1.story1",
  "title": "The Little Fox",
  "author": "StoryNest",
  "language": "en",
  "pages": [
    { "index": 0, "text": "A little fox wandered in the woods. He sniffed the leaves and followed a shiny trail. Along the way he found a friendly squirrel who shared a nut. They played until the sun began to set.", "image": "sample:flower", "audio": "assets/audio/sample_audio_narration_1.mp3" },
    { "index": 1, "text": "The fox learned that sharing made the day brighter. He promised to visit his new friend again. As night fell, the forest glowed with fireflies. He curled up under soft leaves and dreamed.", "audio": "assets/audio/sample_audio_narration_1.mp3" }
  ],
  "sequence": [ { "type": "page", "page_index": 0 }, { "type": "page", "page_index": 1 } ],
  "questions": [],
  "metadata": { "reading_level": "K", "duration_ms": 8000 }
}
