{
  "id": "pack1.story2",
  "title": "The Busy Bee",
  "author": "StoryNest",
  "language": "en",
  "pages": [
    { "index": 0, "text": "A bee buzzed from flower to flower.", "image": "images/bee0.webp", "audio": "audio/bee0.opus" },
    { "index": 1, "text": "She gathered nectar for the hive.", "image": "images/bee1.webp", "audio": "audio/bee1.opus" }
  ],
  "sequence": [ { "type": "page", "page_index": 0 }, { "type": "page", "page_index": 1 } ],
  "questions": [],
  "metadata": { "reading_level": "K", "duration_ms": 7000 }
}
