{
  "id": "pack1.story1",
  "title": "The Little Fox",
  "author": "StoryNest",
  "language": "en",
  "pages": [
    { "index": 0, "text": "A little fox wandered in the woods.", "image": "images/fox0.webp", "audio": "audio/fox0.opus" },
    { "index": 1, "text": "He met a friend and they played.", "image": "images/fox1.webp", "audio": "audio/fox1.opus" }
  ],
  "sequence": [ { "type": "page", "page_index": 0 }, { "type": "page", "page_index": 1 } ],
  "questions": [],
  "metadata": { "reading_level": "K", "duration_ms": 8000 }
}
