{
  "id": "pack2.story1",
  "title": "Spring Flowers",
  "author": "StoryNest",
  "language": "en",
  "pages": [
    { "index": 0, "text": "Flowers bloom in spring. Petals open to welcome warm sunshine and gentle rain. Bees flit between stems while birds return to sing, and the air fills with sweet perfume. Gardens wake up in a riot of color.", "image": "sample:flower", "audio": "assets/audio/sample_audio_narration_1.mp3" }
  ],
  "sequence": [ { "type": "page", "page_index": 0 } ],
  "questions": [],
  "metadata": { "reading_level": "K", "duration_ms": 3000 }
}
